{
  "$schema": "https://devdoc.sh/theme.json",
  "logo": {
    "light": "/assets/logo.svg",
    "dark": "/assets/logo.svg",
    "alt": "Documentation",
    "width": 120,
    "height": 24
  },
  "header": {
    "showAskAI": true,
    "showSearch": true,
    "showThemeToggle": true
  },
  "navbar": {
    "links": [
      {
        "label": "GitHub",
        "href": "https://github.com/brainfish-ai/devdoc",
        "external": true
      }
    ]
  },
  "colors": {
    "primary": "#10b981",
    "primaryLight": "#34d399",
    "primaryDark": "#059669"
  },
  "defaultTheme": "system"
}
